{
  "customerName": "Northstar Medical Logistics",
  "businessDescription": "Coordinates medical equipment delivery, pickup, cleaning status, warehouse movement, and hospital service requests across multiple regions.",
  "applicationNeeds": "Build an internal operations app with dispatch dashboard, service tickets, pickup and delivery workflows, warehouse inventory status, hospital account views, technician task assignments, approvals for urgent replacements, audit logs, role-based access, and reporting.",
  "constraints": {
    "industry": "Healthcare Logistics",
    "compliance": ["Auditability", "Traceability"],
    "integrations": ["CSV import/export", "Future ERP integration"],
    "roles": ["Dispatch Coordinator", "Warehouse Lead", "Technician", "Account Manager"],
    "approvalRequirements": ["Urgent replacement approval", "Bulk inventory changes"],
    "environment": "multi-environment",
    "deploymentTarget": "internal web application",
    "tenancy": "multi-tenant"
  }
}
